{
  "schema_version": "m1.v0.1",
  "request_id": "req-02",
  "task_id": "task-02",
  "base_version": 4,
  "status": "ok",
  "error": null,
  "category": {
    "primary": "coding",
    "secondary": [],
    "reason": "沿用用户已选的编程类别。"
  },
  "proposals": [
    {
      "proposal_id": "p1",
      "operation": "replace",
      "target_item_id": "r2",
      "field": "constraints",
      "text": "本次加入在线付款。",
      "kind": "user_decision",
      "strength": "hard",
      "scope": "报名网站",
      "source_refs": [
        {
          "source_id": "u2",
          "quote": "还是加上在线付款吧"
        }
      ],
      "depends_on": [],
      "reason": "用户明确提出加入付款，与原来的不付款范围相冲突；等待在需求卡接受修改。"
    }
  ],
  "conflicts": [
    {
      "conflict_id": "c1",
      "existing_item_ids": [
        "r2"
      ],
      "proposal_ids": [
        "p1"
      ],
      "description": "已确认范围不包含付款，本轮提出加入在线付款。",
      "change_intent": "explicit_change"
    }
  ],
  "review_item_ids": [],
  "gaps": [
    {
      "gap_id": "g1",
      "field": "constraints",
      "scope": "报名网站",
      "description": "不付款与加入在线付款的范围变更尚未由程序记录接受。",
      "importance": "blocking_direction",
      "origin": "ambiguous",
      "source_refs": [
        {
          "source_id": "u1",
          "quote": "本次不做付款"
        },
        {
          "source_id": "u2",
          "quote": "还是加上在线付款吧"
        }
      ],
      "depends_on": []
    }
  ],
  "questions": [],
  "readiness": {
    "goal_identified": true,
    "deliverable_identified": true,
    "blocking_gap_ids": [
      "g1"
    ],
    "reason": "目标和交付物仍明确，但付款范围的新旧记录冲突，不能按已确认需求继续生成。"
  },
  "next_action": "resolve_conflict",
  "assistant_text": "加入在线付款会改变原先“不做付款”的范围。修改已列为待接受项，请在需求卡核对；其他尚未明确的付款细节会继续保留。"
}
